{
  "$schema": "https://wago.sh/data/facts.schema.json",
  "schemaVersion": 1,
  "generated": "2026-09-10",
  "canonicalUrl": "https://wago.sh/data/facts.json",
  "source": {
    "repository": "https://github.com/wago-org/wago",
    "ref": "bd742cdad68e0bb464ae135973866c73013ffb2f",
    "commit": "bd742cdad68e0bb464ae135973866c73013ffb2f",
    "commitUrl": "https://github.com/wago-org/wago/commit/bd742cdad68e0bb464ae135973866c73013ffb2f"
  },
  "identity": {
    "name": "wago",
    "implementation": "Go",
    "pureGo": true,
    "cgo": false,
    "execution": "single-pass native compiler",
    "interpreter": false
  },
  "release": {
    "status": "Pre-v1 development with beta releases and per-commit canary tags plus workflow artifacts; public stable installation is not yet claimed.",
    "stableVersion": null,
    "apiStability": "pre-v1; no stable-v1 compatibility promise"
  },
  "platforms": [
    {
      "target": "linux/amd64",
      "status": "supported",
      "detail": "native runtime CI",
      "evidence": [
        {
          "label": "native CI matrix",
          "url": "https://github.com/wago-org/wago/blob/bd742cdad68e0bb464ae135973866c73013ffb2f/.github/workflows/ci.yml#L92-L214"
        }
      ]
    },
    {
      "target": "linux/arm64",
      "status": "supported",
      "detail": "native runtime CI",
      "evidence": [
        {
          "label": "native CI matrix",
          "url": "https://github.com/wago-org/wago/blob/bd742cdad68e0bb464ae135973866c73013ffb2f/.github/workflows/ci.yml#L92-L214"
        }
      ]
    },
    {
      "target": "darwin/arm64",
      "status": "supported",
      "detail": "native runtime CI",
      "evidence": [
        {
          "label": "native CI matrix",
          "url": "https://github.com/wago-org/wago/blob/bd742cdad68e0bb464ae135973866c73013ffb2f/.github/workflows/ci.yml#L92-L214"
        }
      ]
    },
    {
      "target": "darwin/amd64",
      "status": "compiler-only",
      "detail": "portable compiler/encoder checks; native JIT ABI is not claimed",
      "evidence": [
        {
          "label": "native CI matrix",
          "url": "https://github.com/wago-org/wago/blob/bd742cdad68e0bb464ae135973866c73013ffb2f/.github/workflows/ci.yml#L92-L214"
        }
      ]
    },
    {
      "target": "windows/*",
      "status": "planned",
      "detail": "no native runtime target claimed",
      "evidence": [
        {
          "label": "feature matrix",
          "url": "https://github.com/wago-org/wago/blob/bd742cdad68e0bb464ae135973866c73013ffb2f/FEATURES.md#L45-L63"
        }
      ]
    }
  ],
  "concurrency": {
    "runtime": "concurrent compile/instantiate/execute on distinct objects is race-tested",
    "compiledModule": "compile once and instantiate many; blanket method-level goroutine-safety is not yet documented",
    "instance": "one active caller at a time; serialize calls",
    "separateInstances": "concurrent callers are accepted, but native Wasm activations are serialized process-wide",
    "nativeExecutionParallelism": "one process-wide native activation at a time",
    "resultLifetime": "instance-owned result buffer remains valid only until the next call"
  },
  "limits": {
    "declaredMemory": true,
    "declaredTables": "partial: initial/minimum size checked; growth maximum is not enforced by Policy.MaxTableEntries",
    "deadlineInterruption": {
      "amd64": true,
      "arm64": true,
      "mechanism": "cooperative native safepoints"
    },
    "policyMaxInvokeDuration": "deprecated-unsupported-use-context-deadline",
    "deterministicFuel": false,
    "aggregateMemoryAccounting": false
  },
  "wasi": {
    "delivery": "outside core; external plugin integration exists but its function-level support was not audited here",
    "preview1": "function-level support matrix not published",
    "preview2": "not claimed"
  },
  "webAssembly": {
    "mvpLegacyReport": {
      "filesPass": 57,
      "filesTotal": 57,
      "percent": 100,
      "assertionsPass": 16592,
      "assertionsFail": 0,
      "assertionsSkip": 1591
    },
    "verification": {
      "checksPass": 155010,
      "checksFail": 0,
      "checksSkip": 22,
      "coverage": 86.1,
      "accountingNote": "Normal, guard-page, WebAssembly 1.0, 2.0, SIMD, and pinned Core 3 assertion gates; the Core 3 total comes from the zero-gap checked-in baseline."
    },
    "proposals": [
      {
        "name": "i32 / i64 integer ops",
        "status": "pass",
        "evidence": [
          {
            "label": "feature matrix",
            "url": "https://github.com/wago-org/wago/blob/bd742cdad68e0bb464ae135973866c73013ffb2f/FEATURES.md#L45-L63"
          }
        ]
      },
      {
        "name": "f32 / f64 ops",
        "status": "pass",
        "evidence": [
          {
            "label": "feature matrix",
            "url": "https://github.com/wago-org/wago/blob/bd742cdad68e0bb464ae135973866c73013ffb2f/FEATURES.md#L45-L63"
          }
        ]
      },
      {
        "name": "f32 / f64 ceil / floor / trunc / nearest / copysign",
        "status": "pass",
        "evidence": [
          {
            "label": "feature matrix",
            "url": "https://github.com/wago-org/wago/blob/bd742cdad68e0bb464ae135973866c73013ffb2f/FEATURES.md#L45-L63"
          }
        ]
      },
      {
        "name": "Conversions + reinterpret",
        "status": "pass",
        "evidence": [
          {
            "label": "feature matrix",
            "url": "https://github.com/wago-org/wago/blob/bd742cdad68e0bb464ae135973866c73013ffb2f/FEATURES.md#L45-L63"
          }
        ]
      },
      {
        "name": "Float→int trunc NaN/overflow traps",
        "status": "pass",
        "evidence": [
          {
            "label": "feature matrix",
            "url": "https://github.com/wago-org/wago/blob/bd742cdad68e0bb464ae135973866c73013ffb2f/FEATURES.md#L45-L63"
          }
        ]
      },
      {
        "name": "Control flow: block / loop / if / else / br / br_if / br_table / return",
        "status": "pass",
        "evidence": [
          {
            "label": "feature matrix",
            "url": "https://github.com/wago-org/wago/blob/bd742cdad68e0bb464ae135973866c73013ffb2f/FEATURES.md#L45-L63"
          }
        ]
      },
      {
        "name": "call / call_indirect",
        "status": "pass",
        "evidence": [
          {
            "label": "feature matrix",
            "url": "https://github.com/wago-org/wago/blob/bd742cdad68e0bb464ae135973866c73013ffb2f/FEATURES.md#L45-L63"
          }
        ]
      },
      {
        "name": "select, drop, nop, unreachable",
        "status": "pass",
        "evidence": [
          {
            "label": "feature matrix",
            "url": "https://github.com/wago-org/wago/blob/bd742cdad68e0bb464ae135973866c73013ffb2f/FEATURES.md#L45-L63"
          }
        ]
      },
      {
        "name": "Locals",
        "status": "pass",
        "evidence": [
          {
            "label": "feature matrix",
            "url": "https://github.com/wago-org/wago/blob/bd742cdad68e0bb464ae135973866c73013ffb2f/FEATURES.md#L45-L63"
          }
        ]
      },
      {
        "name": "Globals",
        "status": "pass",
        "evidence": [
          {
            "label": "feature matrix",
            "url": "https://github.com/wago-org/wago/blob/bd742cdad68e0bb464ae135973866c73013ffb2f/FEATURES.md#L45-L63"
          }
        ]
      },
      {
        "name": "Linear memory load/store",
        "status": "pass",
        "evidence": [
          {
            "label": "feature matrix",
            "url": "https://github.com/wago-org/wago/blob/bd742cdad68e0bb464ae135973866c73013ffb2f/FEATURES.md#L45-L63"
          }
        ]
      },
      {
        "name": "memory.size / memory.grow",
        "status": "pass",
        "evidence": [
          {
            "label": "feature matrix",
            "url": "https://github.com/wago-org/wago/blob/bd742cdad68e0bb464ae135973866c73013ffb2f/FEATURES.md#L45-L63"
          }
        ]
      },
      {
        "name": "Active data segments",
        "status": "pass",
        "evidence": [
          {
            "label": "feature matrix",
            "url": "https://github.com/wago-org/wago/blob/bd742cdad68e0bb464ae135973866c73013ffb2f/FEATURES.md#L45-L63"
          }
        ]
      },
      {
        "name": "Tables + active element segments",
        "status": "pass",
        "evidence": [
          {
            "label": "feature matrix",
            "url": "https://github.com/wago-org/wago/blob/bd742cdad68e0bb464ae135973866c73013ffb2f/FEATURES.md#L45-L63"
          }
        ]
      },
      {
        "name": "Function imports / exports",
        "status": "pass",
        "evidence": [
          {
            "label": "feature matrix",
            "url": "https://github.com/wago-org/wago/blob/bd742cdad68e0bb464ae135973866c73013ffb2f/FEATURES.md#L45-L63"
          }
        ]
      },
      {
        "name": "Memory / table / global imports & exports",
        "status": "pass",
        "evidence": [
          {
            "label": "feature matrix",
            "url": "https://github.com/wago-org/wago/blob/bd742cdad68e0bb464ae135973866c73013ffb2f/FEATURES.md#L45-L63"
          }
        ]
      },
      {
        "name": "start function",
        "status": "pass",
        "evidence": [
          {
            "label": "feature matrix",
            "url": "https://github.com/wago-org/wago/blob/bd742cdad68e0bb464ae135973866c73013ffb2f/FEATURES.md#L45-L63"
          }
        ]
      },
      {
        "name": "Sign-extension ops",
        "status": "pass",
        "evidence": [
          {
            "label": "feature matrix",
            "url": "https://github.com/wago-org/wago/blob/bd742cdad68e0bb464ae135973866c73013ffb2f/FEATURES.md#L45-L63"
          }
        ]
      },
      {
        "name": "Non-trapping float→int",
        "status": "pass",
        "evidence": [
          {